{
  "$schema": "http://json-schema.org/draft-07/schema#",
  "title": "EndpointPilot Configuration",
  "description": "Schema for EndpointPilot global configuration settings",
  "type": "object",
  "properties": {
    "OrgName": {
      "type": "string",
      "description": "Organization name"
    },
    "Refresh_Interval": {
      "type": "number",
      "minimum": 0,
      "description": "Refresh interval in minutes"
    },
    "NetworkScriptRootEnabled": {
      "type": "boolean",
      "description": "Whether to enable the network script root"
    },
    "NetworkScriptRootPath": {
      "type": "string",
      "description": "Network path to script root"
    },
    "HttpsScriptRootEnabled": {
      "type": "boolean",
      "description": "Whether to enable the HTTPS script root"
    },
    "HttpsScriptRootPath": {
      "type": "string",
      "description": "HTTPS path to script root"
    },
    "CopyLogFileToNetwork": {
      "type": "boolean",
      "description": "Whether to copy log files to network location"
    },
    "RoamFiles": {
      "type": "boolean",
      "description": "Whether to enable file roaming"
    },
    "NetworkLogFile": {
      "type": "string",
      "description": "Network path for log files"
    },
    "NetworkRoamFolder": {
      "type": "string",
      "description": "Network path for roaming files"
    },
    "SkipFileOps": {
      "type": "boolean",
      "description": "Whether to skip file operations"
    },
    "SkipDriveOps": {
      "type": "boolean",
      "description": "Whether to skip drive operations"
    },
    "SkipRegOps": {
      "type": "boolean",
      "description": "Whether to skip registry operations"
    },
    "SkipRoamOps": {
      "type": "boolean",
      "description": "Whether to skip roaming operations"
    },
    "DryRun": {
      "type": "boolean",
      "description": "Enable dry-run mode — all operations are logged but no changes are made to the system"
    }
  },
  "required": ["OrgName", "Refresh_Interval", "NetworkScriptRootPath"],
  "additionalProperties": false
}
