{
  "OrgName": "Company Name",
  "Refresh_Interval": 900,
  "NetworkScriptRootPath": "\\\\servername\\SHARE\\PS-EPilot\\",
  "NetworkScriptRootEnabled": true,
  "HttpsScriptRootEnabled": false,
  "HttpsScriptRootPath": "https://servername/SHARE/PS-EPilot/",
  "CopyLogFileToNetwork": false,
  "RoamFiles": false,
  "NetworkLogFile": "\\\\servername\\SHARE\\Tools\\FlagFiles\\EPilot_Script_RunLogs",
  "NetworkRoamFolder": "\\\\servername\\SHARE\\RoamingFiles",
  "SkipFileOps": false,
  "SkipDriveOps": false,
  "SkipRegOps": false,
  "SkipRoamOps": false,
  "DryRun": false
}
